{
  "schema_version": "1.0.0",
  "corpus_id": "hideaki.platform-capability-reference-corpus",
  "authority": {
    "role": "discovery-only",
    "canonical_mutation": false,
    "creates_adoption": false
  },
  "capability_baseline": {
    "authority": "migration-view",
    "source_hint": "hideakisolutions-platform-workspace/docs/platform/platform-capabilities.manifest.json",
    "as_of": "2026-08-24",
    "count": 33,
    "capability_ids": [
      "messaging.event-envelope",
      "api.contracts",
      "http.security-headers",
      "http.correlation-id",
      "resilience",
      "audit",
      "logging",
      "observability",
      "auth",
      "design.tokens",
      "ui.primitives",
      "ui.forms",
      "ui.overlays",
      "ui.feedback",
      "ui.layout",
      "ui.login",
      "configuration",
      "feature-flags",
      "messaging.outbox",
      "persistence",
      "middleware",
      "ai.token-metering",
      "ai.guardrails",
      "multi-tenancy",
      "data.contracts",
      "mobile.tokens",
      "authorization",
      "directory.orggraph",
      "notifications",
      "secrets",
      "ai.mcp-gateway",
      "approval",
      "governance.capability-intake"
    ]
  },
  "semantic_discovery": {
    "authority": "advisory",
    "engine": "qdrant-bge-m3",
    "query": "capacidades comuns reutilizaveis contratos pacotes modulos plataforma shared",
    "executed_on": "2026-08-24"
  },
  "sources": [
    {
      "id": "reference.poynt-hub",
      "repository": "repo.poynt-hub",
      "kind": "product-sentinel",
      "evidence_role": "candidate-source",
      "revision": "1417341edf21480bb2b1f6a69d0b267631d68b13",
      "source_uri": "https://github.com/HideakiSolutions/poynt-hub.git",
      "stacks": ["dotnet", "react", "react-native"],
      "architecture_signals": ["microservices", "shared-libraries", "kafka", "multi-surface"],
      "evidence_paths": [
        "src/Shared/Poynt.Shared.Infrastructure.Outbox/Poynt.Shared.Infrastructure.Outbox.csproj",
        "src/Shared/Poynt.Shared.Infrastructure.Observability/Poynt.Shared.Infrastructure.Observability.csproj",
        "src/Shared/Poynt.Shared.Infrastructure/Poynt.Shared.Infrastructure.csproj",
        "src/Frontend/apps/customer/package.json"
      ],
      "candidate_capabilities": [
        "messaging.event-envelope",
        "api.contracts",
        "http.correlation-id",
        "resilience",
        "audit",
        "logging",
        "observability",
        "auth",
        "configuration",
        "messaging.outbox",
        "persistence",
        "middleware",
        "multi-tenancy",
        "authorization",
        "notifications",
        "secrets",
        "design.tokens",
        "ui.primitives",
        "ui.forms",
        "ui.overlays",
        "ui.feedback",
        "ui.layout",
        "ui.login",
        "mobile.tokens"
      ]
    },
    {
      "id": "reference.cambio-real-v3",
      "repository": "repo.cambio-real-v3",
      "kind": "product-sentinel",
      "evidence_role": "candidate-source",
      "revision": "deb06d8d4e38534198e4786b191ff394f1383a19",
      "source_uri": "https://github.com/cambioreal/cambio-real-v3.git",
      "stacks": ["dotnet", "react"],
      "architecture_signals": ["financial-bounded-contexts", "building-blocks", "outbox", "governed-authorization"],
      "evidence_paths": [
        "src/BuildingBlocks/CambioReal.BuildingBlocks.Application/CambioReal.BuildingBlocks.Application.csproj",
        "src/BuildingBlocks/CambioReal.BuildingBlocks.Domain/CambioReal.BuildingBlocks.Domain.csproj",
        "src/BuildingBlocks/CambioReal.BuildingBlocks.Messaging/CambioReal.BuildingBlocks.Messaging.csproj",
        "src/BuildingBlocks/CambioReal.BuildingBlocks.Web/CambioReal.BuildingBlocks.Web.csproj"
      ],
      "candidate_capabilities": [
        "messaging.event-envelope",
        "api.contracts",
        "http.correlation-id",
        "resilience",
        "audit",
        "logging",
        "observability",
        "auth",
        "configuration",
        "feature-flags",
        "messaging.outbox",
        "persistence",
        "middleware",
        "multi-tenancy",
        "data.contracts",
        "authorization",
        "directory.orggraph",
        "notifications",
        "secrets",
        "approval"
      ]
    },
    {
      "id": "reference.linked-out",
      "repository": "repo.linked-out",
      "kind": "product-sentinel",
      "evidence_role": "candidate-source",
      "revision": "4de4d45b1979ede971739e0dcaec36ce99a3122c",
      "source_uri": "https://github.com/HideakiSolutions/linked-out.git",
      "stacks": ["dotnet", "react"],
      "architecture_signals": ["modular-monolith", "shared-kernel", "outbox", "design-system-candidates"],
      "evidence_paths": [
        "docs/linkedout/CAPABILITY-MAP.md",
        "docs/linkedout/REUSE-MAP.md",
        "backend/src/LinkedOut.SharedKernel/LinkedOut.SharedKernel.csproj",
        "frontend/src/design-system/candidates/PROPOSAL.md"
      ],
      "candidate_capabilities": [
        "messaging.event-envelope",
        "api.contracts",
        "http.security-headers",
        "http.correlation-id",
        "resilience",
        "audit",
        "logging",
        "observability",
        "auth",
        "configuration",
        "messaging.outbox",
        "persistence",
        "middleware",
        "data.contracts",
        "authorization",
        "notifications",
        "design.tokens",
        "ui.primitives",
        "ui.forms",
        "ui.overlays",
        "ui.feedback",
        "ui.layout",
        "ui.login"
      ]
    },
    {
      "id": "reference.cryptor",
      "repository": "repo.cryptor",
      "kind": "product-sentinel",
      "evidence_role": "candidate-source",
      "revision": "b98c1c81417cfe81e5d2f15e90c1ef3b3dba9560",
      "source_uri": "https://github.com/marciohideaki/Cryptor.git",
      "stacks": ["dotnet"],
      "architecture_signals": ["microservices", "event-sourcing", "orleans", "multi-tenancy"],
      "evidence_paths": [
        "src/Core/Cryptor.Core.Abstractions/Cryptor.Core.Abstractions.csproj",
        "src/Core/Cryptor.MultiTenancy/Cryptor.MultiTenancy.csproj",
        "src/Infrastructure/Cryptor.Resilience/Cryptor.Resilience.csproj",
        "src/Infrastructure/Messaging/Cryptor.Messaging.RabbitMQ/Cryptor.Messaging.RabbitMQ.csproj",
        "src/Infrastructure/Observability/Cryptor.Observability.Tracing/Cryptor.Observability.Tracing.csproj"
      ],
      "candidate_capabilities": [
        "messaging.event-envelope",
        "api.contracts",
        "http.correlation-id",
        "resilience",
        "audit",
        "logging",
        "observability",
        "auth",
        "configuration",
        "feature-flags",
        "messaging.outbox",
        "persistence",
        "middleware",
        "multi-tenancy",
        "authorization",
        "notifications",
        "secrets"
      ]
    },
    {
      "id": "reference.srm-asset",
      "repository": "repo.srm-asset",
      "kind": "product-sentinel",
      "evidence_role": "candidate-source",
      "revision": "f4d9a73329ac662bcf1bf7e8f9594afc1fa4da03",
      "source_uri": "https://github.com/HideakiSolutions/srm-asset.git",
      "stacks": ["dotnet", "go", "java", "node", "react"],
      "architecture_signals": ["control-plane-data-plane", "orleans", "ledger", "polyglot"],
      "evidence_paths": [
        "src/srm-services/contracts/proto/ledger.proto",
        "src/srm-services/services/cp-orleans-silo/cp-orleans-silo.csproj",
        "src/srm-services/services/cp-orleans-silo/Grains/Governance/IdempotencyGrain.cs",
        "src/srm-frontend/packages/shared/package.json"
      ],
      "candidate_capabilities": [
        "api.contracts",
        "http.correlation-id",
        "resilience",
        "audit",
        "logging",
        "observability",
        "auth",
        "configuration",
        "messaging.outbox",
        "middleware",
        "multi-tenancy",
        "data.contracts",
        "authorization",
        "notifications",
        "secrets"
      ]
    },
    {
      "id": "reference.platform-core",
      "repository": "repo.platform-core",
      "kind": "canonical-core",
      "evidence_role": "contract-or-projection-source",
      "revision": "86ffef7f118a925bb2993eadfb3ec05eea0ccff8",
      "source_uri": "https://github.com/hideakisolutions/platform-core.git",
      "stacks": ["language-neutral"],
      "architecture_signals": ["json-schema", "contract-first", "capability-intake"],
      "evidence_paths": [
        ".platform/capability-graph.fragment.json",
        "messaging/contracts/event-envelope.schema.json",
        "governance/contracts/capability-intake-v2.schema.json"
      ],
      "candidate_capabilities": [
        "messaging.event-envelope",
        "http.security-headers",
        "audit",
        "logging",
        "observability",
        "auth",
        "configuration",
        "feature-flags",
        "ai.token-metering",
        "ai.guardrails",
        "multi-tenancy",
        "data.contracts",
        "authorization",
        "directory.orggraph",
        "notifications",
        "secrets",
        "ai.mcp-gateway",
        "approval",
        "governance.capability-intake"
      ]
    },
    {
      "id": "reference.backend-core",
      "repository": "repo.backend-core",
      "kind": "canonical-core",
      "evidence_role": "contract-or-projection-source",
      "revision": "1394444be20fdaa8a9fcfa7229df2aa59768c992",
      "source_uri": "https://github.com/hideakisolutions/backend-core.git",
      "stacks": ["dotnet", "go", "java", "node", "python"],
      "architecture_signals": ["polyglot-projections", "packages", "conformance"],
      "evidence_paths": [
        ".platform/capability-graph.fragment.json",
        "dotnet/README.md",
        "golang/docs/README.md",
        "node/README.md",
        "python/README.md",
        "java-spring/messaging-contracts/build.gradle.kts"
      ],